{
  "engine_contract_version": "1.0.0",
  "document_contract": "warehouse.operation-document/v2",
  "document_type": "act",
  "template_id": "warehouse-waybill-ru",
  "template_version": "1.0",
  "locale": "ru-RU",
  "render_profile": "print",
  "document_id": "2a737661-8521-461f-a9aa-f2e9bb4934f2",
  "document_number": "ACT-3-20260810-ca00",
  "document": {
    "basis": {
      "date": null,
      "type": null,
      "label": "Корректировка Могоча",
      "number": null,
      "operation_type_label": "Корректировка"
    },
    "lines": [
      {
        "batch": null,
        "comment": "[catalog merge] item=1674 -> item=4059: balance transfer site=3 qty=10.000",
        "item_id": 4059,
        "item_sku": "",
        "quantity": 10.0,
        "item_name": "",
        "unit_name": "",
        "line_number": 1,
        "unit_symbol": "",
        "category_name": ""
      }
    ],
    "sender": {
      "site_id": 3,
      "site_code": "3",
      "site_name": "Могоча",
      "description": "",
      "organization": {
        "tax_id": null,
        "address": "",
        "contacts": null,
        "legal_name": "Могоча"
      }
    },
    "language": "ru",
    "receiver": null,
    "issued_to": null,
    "operation": {
      "id": "50327bfb-882d-484e-bd24-f0d6ff62281a",
      "type": "ADJUSTMENT",
      "status": "submitted",
      "site_id": 3,
      "created_at": "2026-08-10T03:47:14.601830+00:00",
      "type_label": "Корректировка",
      "effective_at": "2026-08-10T03:47:14.677963+00:00",
      "submitted_at": "2026-08-10T03:47:14.700739+00:00",
      "display_number": "3/0347/100826",
      "source_site_id": null,
      "issue_object_id": null,
      "issue_object_name": null,
      "destination_site_id": null
    },
    "recipient": null,
    "created_by": {
      "role": "chief_storekeeper",
      "user_id": "7c0b0a64-195f-4bf6-859c-939dc0c48d27",
      "username": "LLM",
      "full_name": null
    },
    "signatures": {
      "roles": {
        "accepted_by": null,
        "handed_over": null,
        "chief_accountant": "________________"
      },
      "created_by": null,
      "submitted_by": null
    },
    "basis_label": "Корректировка Могоча",
    "source_site": {
      "site_id": 3,
      "site_code": "3",
      "site_name": "Могоча",
      "description": "",
      "organization": {
        "tax_id": null,
        "address": "",
        "contacts": null,
        "legal_name": "Могоча"
      }
    },
    "total_lines": 1,
    "generated_at": "2026-08-10T03:47:14.725000+00:00",
    "localization": {
      "currency": "RUB",
      "language": "ru",
      "date_format": "%d.%m.%Y",
      "datetime_format": "%d.%m.%Y %H:%M:%S",
      "thousands_separator": " ",
      "number_decimal_separator": ","
    },
    "operation_id": "50327bfb-882d-484e-bd24-f0d6ff62281a",
    "submitted_by": {
      "role": "chief_storekeeper",
      "user_id": "7c0b0a64-195f-4bf6-859c-939dc0c48d27",
      "username": "LLM",
      "full_name": null
    },
    "document_title": "Акт",
    "operation_type": "ADJUSTMENT",
    "consignee_label": "Могоча",
    "operation_notes": "[catalog merge] item=1674 -> item=4059: balance transfer site=3 qty=10.000",
    "destination_site": null,
    "operation_status": "submitted",
    "operation_created_at": "2026-08-10T03:47:14.601830+00:00",
    "operation_type_label": "Корректировка",
    "operation_effective_at": "2026-08-10T03:47:14.677963+00:00",
    "operation_submitted_at": "2026-08-10T03:47:14.700739+00:00",
    "operation_display_number": "3/0347/100826",
    "operation_acceptance_state": "not_required"
  },
  "assets": {}
}