{
  "engine_contract_version": "1.0.0",
  "document_contract": "warehouse.operation-document/v2",
  "document_type": "waybill",
  "template_id": "warehouse-waybill-ru",
  "template_version": "1.0",
  "locale": "ru-RU",
  "render_profile": "print",
  "document_id": "09ddaed7-b2d7-47ce-a4be-af1c4c0f9d32",
  "document_number": "WB-1-20260810-d21c",
  "document": {
    "basis": {
      "date": null,
      "type": null,
      "label": "Списание Угдан",
      "number": null,
      "operation_type_label": "Списание"
    },
    "lines": [
      {
        "batch": null,
        "comment": null,
        "item_id": 1073,
        "item_sku": "20902",
        "quantity": 60.0,
        "item_name": "Перчатки х/б ПВХ Чел 5 нитей 10/200 34269",
        "unit_name": "Пара",
        "line_number": 1,
        "unit_symbol": "пар",
        "category_name": "Перчатки"
      },
      {
        "batch": null,
        "comment": null,
        "item_id": 4119,
        "item_sku": "",
        "quantity": 3.0,
        "item_name": "М/с АОС для посуды 900 г/12 АО «Нэфис косметикс»",
        "unit_name": "Штука",
        "line_number": 2,
        "unit_symbol": "шт",
        "category_name": "Бытовая химия"
      },
      {
        "batch": null,
        "comment": null,
        "item_id": 4085,
        "item_sku": "",
        "quantity": 30.0,
        "item_name": "Полотно ХПП 0,80*50 м короткое, Кинешма",
        "unit_name": "Метр",
        "line_number": 3,
        "unit_symbol": "м",
        "category_name": "Текстиль"
      },
      {
        "batch": null,
        "comment": null,
        "item_id": 1814,
        "item_sku": "00-00021301",
        "quantity": 2.0,
        "item_name": "Ср-во \"Доместос\" 1л/12 00-00021301",
        "unit_name": "Штука",
        "line_number": 4,
        "unit_symbol": "шт",
        "category_name": "Бытовая химия"
      },
      {
        "batch": null,
        "comment": null,
        "item_id": 500,
        "item_sku": "",
        "quantity": 2.0,
        "item_name": "Ср-во Азелит антижир 600мл",
        "unit_name": "Штука",
        "line_number": 5,
        "unit_symbol": "шт",
        "category_name": "Бытовая химия"
      },
      {
        "batch": null,
        "comment": null,
        "item_id": 1990,
        "item_sku": "00-00035937",
        "quantity": 16.0,
        "item_name": "СМС Бимакс 400г/100 пятен/24 АО \"Нэфис косметикс\"",
        "unit_name": "Штука",
        "line_number": 6,
        "unit_symbol": "шт",
        "category_name": "Без категории"
      },
      {
        "batch": null,
        "comment": null,
        "item_id": 1790,
        "item_sku": "00-00040810",
        "quantity": 1.0,
        "item_name": "Веник 3-х палый большой",
        "unit_name": "Штука",
        "line_number": 7,
        "unit_symbol": "шт",
        "category_name": "Без категории"
      },
      {
        "batch": null,
        "comment": null,
        "item_id": 3595,
        "item_sku": "",
        "quantity": 5.0,
        "item_name": "Круг 125мм Р 100 8 отв. MINAMO Light Matter/10-0100",
        "unit_name": "Штука",
        "line_number": 8,
        "unit_symbol": "шт",
        "category_name": "Шлифовальные круги"
      },
      {
        "batch": null,
        "comment": null,
        "item_id": 3596,
        "item_sku": "",
        "quantity": 5.0,
        "item_name": "Круг 125мм Р180 8отв.MINAMO Heavy Duty PF/01-0180",
        "unit_name": "Штука",
        "line_number": 9,
        "unit_symbol": "шт",
        "category_name": "Шлифовальные круги"
      },
      {
        "batch": null,
        "comment": null,
        "item_id": 2073,
        "item_sku": "HAS97135",
        "quantity": 5.0,
        "item_name": "Круг 125 мм Р240 8 отв GOLD/HOLEX HAS97135",
        "unit_name": "Штука",
        "line_number": 10,
        "unit_symbol": "шт",
        "category_name": "Без категории"
      },
      {
        "batch": null,
        "comment": null,
        "item_id": 2031,
        "item_sku": "10082",
        "quantity": 5.0,
        "item_name": "Зачистной круг GTOOL CD синий 125*15*22,2мм 10082",
        "unit_name": "Штука",
        "line_number": 11,
        "unit_symbol": "шт",
        "category_name": "Без категории"
      },
      {
        "batch": null,
        "comment": null,
        "item_id": 1352,
        "item_sku": "PX E-04/750",
        "quantity": 1.0,
        "item_name": "Белая 040 0,8 кг. алкид/REOFLEX",
        "unit_name": "Штука",
        "line_number": 12,
        "unit_symbol": "шт",
        "category_name": "Автохимия и чистящие средства"
      },
      {
        "batch": null,
        "comment": null,
        "item_id": 650,
        "item_sku": "20988",
        "quantity": 10.0,
        "item_name": "Полотно вафельное 45см",
        "unit_name": "Метр",
        "line_number": 13,
        "unit_symbol": "м",
        "category_name": "Полотно вафельное"
      },
      {
        "batch": null,
        "comment": null,
        "item_id": 669,
        "item_sku": "20644",
        "quantity": 16.0,
        "item_name": "Мыло туал.\"Банное\"  175гр/72шт",
        "unit_name": "Штука",
        "line_number": 14,
        "unit_symbol": "шт",
        "category_name": "Бытовая химия"
      }
    ],
    "sender": {
      "site_id": 1,
      "site_code": "1",
      "site_name": "Угдан",
      "description": "",
      "organization": {
        "tax_id": null,
        "address": "",
        "contacts": null,
        "legal_name": "Угдан"
      }
    },
    "language": "ru",
    "receiver": null,
    "issued_to": null,
    "operation": {
      "id": "25df83bb-98f7-4a05-a1cd-688bcd504b1a",
      "type": "WRITE_OFF",
      "status": "submitted",
      "site_id": 1,
      "created_at": "2026-07-30T06:33:37.591979+00:00",
      "type_label": "Списание",
      "effective_at": "2026-07-30T06:32:00+00:00",
      "submitted_at": "2026-08-05T03:40:57.195764+00:00",
      "display_number": "300726/0633/1",
      "source_site_id": 1,
      "issue_object_id": null,
      "issue_object_name": null,
      "destination_site_id": null
    },
    "recipient": null,
    "created_by": {
      "role": "chief_storekeeper",
      "user_id": "7337709e-a82b-4813-8b4d-283addc7a9c3",
      "username": "Svetlana",
      "full_name": "Светлана Викторовна"
    },
    "signatures": {
      "roles": {
        "accepted_by": null,
        "handed_over": "Светлана Викторовна",
        "chief_accountant": "________________"
      },
      "created_by": "Светлана Викторовна",
      "submitted_by": "Светлана Викторовна"
    },
    "basis_label": "Списание Угдан",
    "source_site": {
      "site_id": 1,
      "site_code": "1",
      "site_name": "Угдан",
      "description": "",
      "organization": {
        "tax_id": null,
        "address": "",
        "contacts": null,
        "legal_name": "Угдан"
      }
    },
    "total_lines": 14,
    "generated_at": "2026-08-10T04:44:16.764999+00:00",
    "localization": {
      "currency": "RUB",
      "language": "ru",
      "date_format": "%d.%m.%Y",
      "datetime_format": "%d.%m.%Y %H:%M:%S",
      "thousands_separator": " ",
      "number_decimal_separator": ","
    },
    "operation_id": "25df83bb-98f7-4a05-a1cd-688bcd504b1a",
    "submitted_by": {
      "role": "chief_storekeeper",
      "user_id": "7337709e-a82b-4813-8b4d-283addc7a9c3",
      "username": "Svetlana",
      "full_name": "Светлана Викторовна"
    },
    "document_title": "Товарная накладная",
    "operation_type": "WRITE_OFF",
    "consignee_label": "Угдан",
    "operation_notes": null,
    "destination_site": null,
    "operation_status": "submitted",
    "operation_created_at": "2026-07-30T06:33:37.591979+00:00",
    "operation_type_label": "Списание",
    "operation_effective_at": "2026-07-30T06:32:00+00:00",
    "operation_submitted_at": "2026-08-05T03:40:57.195764+00:00",
    "operation_display_number": "300726/0633/1",
    "operation_acceptance_state": "not_required"
  },
  "assets": {}
}