{
  "engine_contract_version": "1.0.0",
  "document_contract": "warehouse.operation-document/v2",
  "document_type": "waybill",
  "template_id": "warehouse-waybill-ru",
  "template_version": "0.1.0",
  "locale": "ru-RU",
  "render_profile": "print",
  "document_id": "9f8e7d6c-5b4a-3210-fedc-ba9876543210",
  "document_number": "WAYBILL-000020",
  "document": {
    "header": {
      "organization_name": "ООО «Вектор Логистик»",
      "organization_inn": "7712345678",
      "organization_kpp": "770101001",
      "warehouse_name": "Склад № 4 «Северный терминал»",
      "operation_type": "Отгрузка со склада",
      "operation_date": "2026-08-10",
      "counterparty_name": "АО «Торговый дом „Меридиан“»"
    },
    "lines": [
      {"seq": 1, "sku": "SKU-0001", "name": "Болт М8х40 оцинкованный с гайкой и шайбой, класс прочности 8.8", "unit": "шт", "qty": 1200.0, "price": 3.55, "amount": 4260.0},
      {"seq": 2, "sku": "SKU-0002", "name": "Гайка М8 шестигранная DIN 934, шаг 1.25, оцинкованная", "unit": "шт", "qty": 3400.0, "price": 1.2, "amount": 4080.0},
      {"seq": 3, "sku": "SKU-0003", "name": "Шайба плоская М8 DIN 125, увеличенная, оцинкованная", "unit": "шт", "qty": 6500.0, "price": 0.45, "amount": 2925.0},
      {"seq": 4, "sku": "SKU-0004", "name": "Труба профильная 40х20х2 сталь 09Г2С, длина 6 метров", "unit": "м", "qty": 180.0, "price": 142.8, "amount": 25704.0},
      {"seq": 5, "sku": "SKU-0005", "name": "Уголок стальной 50х50х5 ГОСТ 8509-93, длина 6 метров", "unit": "м", "qty": 96.0, "price": 198.4, "amount": 19046.4},
      {"seq": 6, "sku": "SKU-0006", "name": "Лист стальной горячекатаный 3х1250х2500 мм, сталь 3", "unit": "шт", "qty": 24.0, "price": 2450.0, "amount": 58800.0},
      {"seq": 7, "sku": "SKU-0007", "name": "Электрод сварочный УОНИ-13/55 Ø3 мм, упаковка 5 кг", "unit": "уп", "qty": 40.0, "price": 890.0, "amount": 35600.0},
      {"seq": 8, "sku": "SKU-0008", "name": "Краска эмаль ПФ-115 серая, ведро 25 кг", "unit": "шт", "qty": 12.0, "price": 6120.0, "amount": 73440.0},
      {"seq": 9, "sku": "SKU-0009", "name": "Растворитель уайт-спирит 646, канистра 10 л", "unit": "шт", "qty": 30.0, "price": 1450.0, "amount": 43500.0},
      {"seq": 10, "sku": "SKU-0010", "name": "Перчатки хлопчатобумажные с ПВХ-точкой, пара", "unit": "пар", "qty": 500.0, "price": 18.5, "amount": 9250.0},
      {"seq": 11, "sku": "SKU-0011", "name": "Кабель силовой ВВГнг-LS 3х2.5, бухта 100 м", "unit": "м", "qty": 1500.0, "price": 48.9, "amount": 73350.0},
      {"seq": 12, "sku": "SKU-0012", "name": "Автоматический выключатель IEK ВА47-29, 1P, 16А, C", "unit": "шт", "qty": 200.0, "price": 186.0, "amount": 37200.0},
      {"seq": 13, "sku": "SKU-0013", "name": "Розетка Schneider Electric Glossa, с заземлением, белая", "unit": "шт", "qty": 150.0, "price": 324.0, "amount": 48600.0},
      {"seq": 14, "sku": "SKU-0014", "name": "Труба ПНД ПЭ100 SDR11 Ø32 мм, бухта 50 м", "unit": "м", "qty": 800.0, "price": 34.2, "amount": 27360.0},
      {"seq": 15, "sku": "SKU-0015", "name": "Фитинг компрессионный ПНД Ø32 мм, резьба 1\" внутренняя", "unit": "шт", "qty": 320.0, "price": 96.0, "amount": 30720.0},
      {"seq": 16, "sku": "SKU-0016", "name": "Кран шаровой латунный 1\" полнопроходной, ручка-рычаг", "unit": "шт", "qty": 85.0, "price": 512.0, "amount": 43520.0},
      {"seq": 17, "sku": "SKU-0017", "name": "Смеситель для мойки с гибкой подводкой 0.5 м, хромированный", "unit": "шт", "qty": 40.0, "price": 1980.0, "amount": 79200.0},
      {"seq": 18, "sku": "SKU-0018", "name": "Ламинат 32 класса дуб светлый, упаковка 2.13 м²", "unit": "уп", "qty": 300.0, "price": 890.0, "amount": 267000.0},
      {"seq": 19, "sku": "SKU-0019", "name": "Плинтус ПВХ 40 мм с кабель-каналом, белый, длина 2.5 м", "unit": "шт", "qty": 600.0, "price": 148.0, "amount": 88800.0},
      {"seq": 20, "sku": "SKU-0020", "name": "Клей для ПВХ-плинтуса белый, туба 300 мл", "unit": "шт", "qty": 240.0, "price": 96.0, "amount": 23040.0}
    ]
  },
  "assets": {}
}